{
  "title": "aria-roledescription attribute with HTML section",
  "description": "This test ensures that the value of aria-roledescription is announced by screen readers",
  "assertions": [
    {
      "feature_id": "aria/aria-roledescription_attribute",
      "feature_assertion_id": "convey_value",
      "css_target": "#target",
      "results": {
        "jaws": {
          "browsers": {
            "edge": {
              "output": [
                {
                  "command": "next_item",
                  "output": "Target",
                  "result": "fail"
                }
              ]
            },
            "ie": {
              "output": [
                {
                  "command": "next_item",
                  "output": "Target",
                  "result": "fail"
                }
              ]
            }
          }
        },
        "narrator": {
          "browsers": {
            "edge": {
              "output": [
                {
                  "command": "next_item",
                  "output": "Target",
                  "result": "fail"
                }
              ]
            }
          }
        },
        "nvda": {
          "browsers": {
            "firefox": {
              "output": [
                {
                  "command": "next_item",
                  "output": "Section name custom section role. Target.",
                  "result": "pass"
                }
              ]
            }
          }
        },
        "vo_macos": {
          "browsers": {
            "safari": {
              "output": [
                {
                  "command": "next_item",
                  "output": "Section name, custom section role",
                  "result": "pass"
                }
              ]
            }
          }
        },
        "vo_ios": {
          "browsers": {
            "ios_saf": {
              "output": [
                {
                  "command": "next_item",
                  "output": "Target, section name, landmark",
                  "result": "fail"
                }
              ],
              "notes": ""
            }
          }
        }
      }
    }
  ],
  "history": [
    {
      "date": "2018-11-12",
      "message": "Test created"
    }
  ],
  "versions": {
    "jaws": {
      "browsers": {
        "ie": {
          "at_version": "2018.1808.10",
          "browser_version": "11.55",
          "os_version": "17763",
          "date": "2018-11-12"
        },
        "edge": {
          "at_version": "2018.1808.10",
          "browser_version": "44.17763.1.0",
          "os_version": "17763",
          "date": "2018-11-12"
        }
      }
    },
    "narrator": {
      "browsers": {
        "edge": {
          "at_version": "17763",
          "browser_version": "44.17763.1.0",
          "os_version": "17763",
          "date": "2018-11-12"
        }
      }
    },
    "nvda": {
      "browsers": {
        "firefox": {
          "at_version": "2018.3.2",
          "browser_version": "63.0.1",
          "os_version": "17763",
          "date": "2018-11-12"
        }
      }
    },
    "vo_ios": {
      "browsers": {
        "ios_saf": {
          "at_version": "12.1",
          "browser_version": "12.1",
          "os_version": "12.1",
          "date": "2018-11-12"
        }
      }
    },
    "vo_macos": {
      "browsers": {
        "safari": {
          "at_version": "10.14.1",
          "browser_version": "12.0.1",
          "os_version": "10.14.1",
          "date": "2018-10-19"
        }
      }
    }
  }
}