{
  "title": "CSS Generated Content with HTML span element",
  "description": "This test uses ::before and ::after pseudo classes to add content to static text",
  "assertions": [
    {
      "feature_id": "css/generated_content",
      "feature_assertion_id": "part_of_accessible_name",
      "css_target": "#target",
      "results": {
        "jaws": {
          "browsers": {
            "firefox": {
              "output": [
                {
                  "command": "next_item",
                  "output": "This is generated content.",
                  "result": "pass"
                }
              ]
            },
            "ie": {
              "output": [
                {
                  "command": "next_item",
                  "output": "is generated",
                  "result": "fail"
                }
              ]
            },
            "edge": {
              "output": [
                {
                  "command": "next_item",
                  "output": "This is generated content.",
                  "result": "pass"
                }
              ]
            }
          }
        },
        "nvda": {
          "browsers": {
            "firefox": {
              "output": [
                {
                  "command": "next_item",
                  "output": "This is generated content.",
                  "result": "pass"
                }
              ]
            }
          }
        },
        "vo_ios": {
          "browsers": {
            "ios_saf": {
              "output": [
                {
                  "command": "next_item",
                  "output": "this. is generated. content.",
                  "result": "pass"
                },
                {
                  "command": "start_reading",
                  "output": "this is generated content",
                  "result": "pass"
                }
              ],
              "notes": "When using the next/previous line command, you have to swipe left/right three times to hear the entire sentence. The first swipe right reads the before generated content 'this', the next swipe right reads the html contents 'is generated', and the final swipe right reads the after generated content 'content'."
            }
          }
        },
        "vo_macos": {
          "browsers": {
            "safari": {
              "output": [
                {
                  "command": "next_item",
                  "output": "This is generated content.",
                  "result": "pass"
                },
                {
                  "command": "start_reading",
                  "output": "This is generated content.",
                  "result": "pass"
                }
              ],
              "notes": ""
            }
          }
        },
        "narrator": {
          "browsers": {
            "edge": {
              "output": [
                {
                  "command": "next_item",
                  "output": "This is generated content.",
                  "result": "pass"
                }
              ],
              "notes": ""
            }
          }
        }
      }
    }
  ],
  "history": [
    {
      "date": "2018-07-06",
      "message": "Sample data has been added. This data has not been verified."
    },
    {
      "date": "2018-08-12",
      "message": "vo_ios/ios_saf support updated"
    },
    {
      "date": "2018-08-19",
      "message": "vo_macos/safari support updated"
    },
    {
      "date": "2018-12-17",
      "message": "narrator/edge support updated"
    },
    {
      "date": "2019-03-21",
      "message": "jaws/ie updated with latest versions"
    }
  ],
  "versions": {
    "jaws": {
      "browsers": {
        "ie": {
          "at_version": "2019.1903",
          "browser_version": "11",
          "os_version": "1809",
          "date": "2019-03-21"
        },
        "firefox": {
          "at_version": "18",
          "browser_version": "60",
          "os_version": "17134",
          "date": "2018-07-21"
        },
        "edge": {
          "at_version": "18",
          "browser_version": "17",
          "os_version": "17134",
          "date": "2018-07-21"
        }
      }
    },
    "narrator": {
      "browsers": {
        "edge": {
          "at_version": "1809",
          "browser_version": "44",
          "os_version": "1809",
          "date": "2018-12-17"
        }
      }
    },
    "nvda": {
      "browsers": {
        "firefox": {
          "at_version": "2018.1.1",
          "browser_version": "60",
          "os_version": "17134",
          "date": "2018-07-21"
        }
      }
    },
    "vo_ios": {
      "browsers": {
        "ios_saf": {
          "at_version": "11.4.1",
          "browser_version": "11.4.1",
          "os_version": "11.4.1",
          "date": "2018-08-12"
        }
      }
    },
    "vo_macos": {
      "browsers": {
        "safari": {
          "at_version": "10.13.6",
          "browser_version": "11.1.2",
          "os_version": "10.13.6",
          "date": "2018-08-19"
        }
      }
    }
  }
}