{
  "title": "HTML LI element in a OL with a sub OL (setsize)",
  "description": "This test ensures that the number of items in a list are being computed correctly when there is a sub-list.",
  "html_file": "html_li_element_in_ol_with_sub_ol.html",
  "assertions": [
    {
      "feature_id": "html/ol_element",
      "feature_assertion_id": "convey_setsize",
      "css_target": "#target",
      "expected_value": "3",
      "results": {
        "narrator": {
          "browsers": {
            "edge": {
              "output": [
                {
                  "command": "next_item",
                  "output": "\"Enter list. 1. Target. 1 of 3 level 1.\"",
                  "result": "pass"
                }
              ],
              "notes": ""
            }
          }
        },
        "nvda": {
          "browsers": {
            "firefox": {
              "output": [
                {
                  "command": "next_item",
                  "output": "\"List with 3 items. 1. Target.\"",
                  "result": "pass"
                }
              ]
            },
            "chrome": {
              "output": [
                {
                  "command": "next_item",
                  "output": "\"List with 3 items. 1. Target.\"",
                  "result": "pass"
                }
              ]
            }
          }
        },
        "jaws": {
          "browsers": {
            "ie": {
              "output": [
                {
                  "command": "next_item",
                  "output": "\"List of 3 items\"",
                  "result": "pass"
                }
              ],
              "notes": ""
            },
            "firefox": {
              "output": [
                {
                  "command": "next_item",
                  "output": "\"List of 3 items\"",
                  "result": "pass"
                }
              ],
              "notes": ""
            },
            "chrome": {
              "output": [
                {
                  "command": "next_item",
                  "output": "\"List of 3 items\"",
                  "result": "pass"
                }
              ],
              "notes": ""
            }
          }
        },
        "vo_macos": {
          "browsers": {
            "safari": {
              "output": [
                {
                  "command": "next_item",
                  "output": "list. 3 items",
                  "result": "pass"
                }
              ]
            }
          }
        },
        "vo_ios": {
          "browsers": {
            "ios_saf": {
              "output": [
                {
                  "command": "next_item",
                  "output": "Target. List Start",
                  "result": "fail"
                }
              ],
              "notes": ""
            }
          }
        }
      }
    }
  ],
  "history": [
    {
      "date": "2018-10-19",
      "message": "Test created"
    }
  ],
  "versions": {
    "jaws": {
      "browsers": {
        "chrome": {
          "at_version": "2018.1811.2",
          "browser_version": "74",
          "os_version": "1809",
          "date": "2019-05-20"
        },
        "ie": {
          "at_version": "2018.1811.2",
          "browser_version": "11.134",
          "os_version": "1809",
          "date": "2019-05-20"
        },
        "firefox": {
          "at_version": "2018.1811.2",
          "browser_version": "66",
          "os_version": "1809",
          "date": "2019-05-20"
        }
      }
    },
    "narrator": {
      "browsers": {
        "edge": {
          "at_version": "1809",
          "browser_version": "44.17763",
          "os_version": "1809",
          "date": "2019-05-20"
        }
      }
    },
    "nvda": {
      "browsers": {
        "chrome": {
          "at_version": "2018.1808.10",
          "browser_version": "74",
          "os_version": "1809",
          "date": "2019-05-20"
        },
        "firefox": {
          "at_version": "2018.3.2",
          "browser_version": "62",
          "os_version": "17763",
          "date": "2018-10-19"
        }
      }
    },
    "vo_ios": {
      "browsers": {
        "ios_saf": {
          "at_version": "12.2",
          "browser_version": "12.2",
          "os_version": "12.2",
          "date": "2019-05-20"
        }
      }
    },
    "vo_macos": {
      "browsers": {
        "safari": {
          "at_version": "10.14",
          "browser_version": "12",
          "os_version": "10.14",
          "date": "2018-10-19"
        }
      }
    }
  }
}