{
  "title": "aria-labelledby with one reference test",
  "description": "A simple aria-labelledby test that references a single ID",
  "html_file": "aria/aria-labelling.html",
  "assertions": [
    {
      "feature_id": "aria/aria-label_attribute",
      "feature_assertion_id": "contribute_to_accessible_name",
      "results": {
        "dragon_win": {
          "browsers": {
            "chrome": {
              "output": [
                {
                  "command": "activate_name",
                  "output": "\"\"",
                  "result": "unknown"
                }
              ]
            }
          }
        },
        "jaws": {
          "browsers": {
            "chrome": {
              "output": [
                {
                  "command": "next_item",
                  "from": "before target",
                  "to": "target",
                  "output": "\"\"",
                  "result": "unknown"
                },
                {
                  "command": "next_focusable_item",
                  "from": "before target",
                  "to": "target",
                  "output": "\"\"",
                  "result": "unknown"
                }
              ]
            },
            "ie": {
              "output": [
                {
                  "command": "next_item",
                  "from": "before target",
                  "to": "target",
                  "output": "\"\"",
                  "result": "unknown"
                },
                {
                  "command": "next_focusable_item",
                  "from": "before target",
                  "to": "target",
                  "output": "\"\"",
                  "result": "unknown"
                }
              ]
            },
            "firefox": {
              "output": [
                {
                  "command": "next_item",
                  "from": "before target",
                  "to": "target",
                  "output": "\"\"",
                  "result": "unknown"
                },
                {
                  "command": "next_focusable_item",
                  "from": "before target",
                  "to": "target",
                  "output": "\"\"",
                  "result": "unknown"
                }
              ]
            }
          }
        },
        "narrator": {
          "browsers": {
            "edge": {
              "output": [
                {
                  "command": "next_item",
                  "from": "before target",
                  "to": "target",
                  "output": "\"\"",
                  "result": "unknown"
                },
                {
                  "command": "next_focusable_item",
                  "from": "before target",
                  "to": "target",
                  "output": "\"\"",
                  "result": "unknown"
                }
              ]
            }
          }
        },
        "nvda": {
          "browsers": {
            "chrome": {
              "output": [
                {
                  "command": "next_item",
                  "from": "before target",
                  "to": "target",
                  "output": "\"\"",
                  "result": "unknown"
                },
                {
                  "command": "next_focusable_item",
                  "from": "before target",
                  "to": "target",
                  "output": "\"\"",
                  "result": "unknown"
                }
              ]
            },
            "firefox": {
              "output": [
                {
                  "command": "next_item",
                  "from": "before target",
                  "to": "target",
                  "output": "\"\"",
                  "result": "unknown"
                },
                {
                  "command": "next_focusable_item",
                  "from": "before target",
                  "to": "target",
                  "output": "\"\"",
                  "result": "unknown"
                }
              ]
            }
          }
        },
        "talkback": {
          "browsers": {
            "and_chr": {
              "output": [
                {
                  "command": "next_item",
                  "from": "before target",
                  "to": "target",
                  "output": "\"\"",
                  "result": "unknown"
                }
              ]
            }
          }
        },
        "vo_ios": {
          "browsers": {
            "ios_saf": {
              "output": [
                {
                  "command": "next_item",
                  "from": "before target",
                  "to": "target",
                  "output": "\"\"",
                  "result": "unknown"
                }
              ]
            }
          }
        },
        "vo_macos": {
          "browsers": {
            "safari": {
              "output": [
                {
                  "command": "next_item",
                  "from": "before target",
                  "to": "target",
                  "output": "\"\"",
                  "result": "unknown"
                },
                {
                  "command": "next_focusable_item",
                  "from": "before target",
                  "to": "target",
                  "output": "\"\"",
                  "result": "unknown"
                }
              ]
            }
          }
        },
        "orca": {
          "browsers": {
            "firefox": {
              "output": [
                {
                  "command": "next_item",
                  "from": "before target",
                  "to": "target",
                  "output": "\"\"",
                  "result": "unknown"
                },
                {
                  "command": "next_focusable_item",
                  "from": "before target",
                  "to": "target",
                  "output": "\"\"",
                  "result": "unknown"
                }
              ]
            }
          }
        },
        "vc_ios": {
          "browsers": {
            "ios_saf": {
              "output": [
                {
                  "command": "activate_name",
                  "output": "\"\"",
                  "result": "unknown"
                }
              ]
            }
          }
        }
      }
    }
  ],
  "history": [
    {
      "date": "2019-09-27",
      "message": "Test created"
    }
  ],
  "versions": {
    "dragon_win": {
      "browsers": {
        "chrome": {
          "at_version": "15.30",
          "browser_version": "77",
          "os_version": "1903",
          "date": "2019-09-27"
        }
      }
    },
    "jaws": {
      "browsers": {
        "chrome": {
          "at_version": "2019.1907.42",
          "browser_version": "77",
          "os_version": "1903",
          "date": "2019-09-27"
        },
        "ie": {
          "at_version": "2019.1907.42",
          "browser_version": "11",
          "os_version": "1903",
          "date": "2019-09-27"
        },
        "firefox": {
          "at_version": "2019.1907.42",
          "browser_version": "69",
          "os_version": "1903",
          "date": "2019-09-27"
        }
      }
    },
    "narrator": {
      "browsers": {
        "edge": {
          "at_version": "1903",
          "browser_version": "44",
          "os_version": "1903",
          "date": "2019-09-27"
        }
      }
    },
    "nvda": {
      "browsers": {
        "chrome": {
          "at_version": "2019.2",
          "browser_version": "77",
          "os_version": "1903",
          "date": "2019-09-27"
        },
        "firefox": {
          "at_version": "2019.2",
          "browser_version": "69",
          "os_version": "1903",
          "date": "2019-09-27"
        }
      }
    },
    "orca": {
      "browsers": {
        "firefox": {
          "at_version": "3.31.4",
          "browser_version": "69",
          "os_version": "Ubuntu 19.04",
          "date": "2019-09-27"
        }
      }
    },
    "talkback": {
      "browsers": {
        "and_chr": {
          "at_version": "7.3.0",
          "browser_version": "77",
          "os_version": "9",
          "date": "2019-09-27"
        }
      }
    },
    "vo_ios": {
      "browsers": {
        "ios_saf": {
          "at_version": "13.1",
          "browser_version": "13.1",
          "os_version": "13.1",
          "date": "2019-09-27"
        }
      }
    },
    "vo_macos": {
      "browsers": {
        "safari": {
          "at_version": "10.14.6",
          "browser_version": "13.0.1",
          "os_version": "10.14.6",
          "date": "2019-09-27"
        }
      }
    },
    "vc_ios": {
      "browsers": {
        "ios_saf": {
          "at_version": "13.1",
          "browser_version": "13.1",
          "os_version": "13.1",
          "date": "2019-09-27"
        }
      }
    }
  }
}
