{
  "title": "HTML section element with no accessible name",
  "description": "This section has no accessible name per HTML AAM 5.15.1 Section and Grouping Element Accessible Name Computation. It will not be mapped to a role and should be considered presentational.",
  "assertions": [
    {
      "feature_id": "html/section_element",
      "feature_assertion_id": "no_role_if_not_named",
      "css_target": "#target",
      "results": {
        "jaws": {
          "browsers": {
            "chrome": {
              "output": [
                {
                  "command": "next_item",
                  "from": "before target",
                  "to": "target",
                  "output": "\"sample text line 1\"",
                  "result": "pass"
                }
              ]
            },
            "ie": {
              "output": [
                {
                  "command": "next_item",
                  "output": "\"sample text line 1\"",
                  "result": "pass"
                }
              ]
            },
            "firefox": {
              "output": [
                {
                  "command": "next_item",
                  "from": "before target",
                  "to": "target",
                  "output": "\"sample text line 1\"",
                  "result": "pass"
                }
              ]
            }
          }
        },
        "narrator": {
          "browsers": {
            "edge": {
              "output": [
                {
                  "command": "next_item",
                  "from": "before target",
                  "to": "target",
                  "output": "\"sample text line 1\"",
                  "result": "pass"
                }
              ]
            }
          }
        },
        "nvda": {
          "browsers": {
            "firefox": {
              "output": [
                {
                  "command": "next_item",
                  "from": "before target",
                  "to": "start of target",
                  "output": "\"Sample text line 1\"",
                  "result": "pass"
                }
              ]
            },
            "chrome": {
              "output": [
                {
                  "command": "next_item",
                  "from": "before target",
                  "to": "start of target",
                  "output": "\"Sample text line 1\"",
                  "result": "pass"
                }
              ]
            }
          }
        },
        "vo_macos": {
          "browsers": {
            "safari": {
              "output": [
                {
                  "command": "next_item",
                  "from": "before target",
                  "to": "start of target",
                  "output": "\"sample text, line 1\"",
                  "result": "pass"
                }
              ]
            }
          }
        },
        "talkback": {
          "browsers": {
            "and_chr": {
              "output": [
                {
                  "command": "next_item",
                  "from": "before target",
                  "to": "target",
                  "output": "\"sample text, line 1\"",
                  "result": "pass"
                }
              ]
            }
          }
        },
        "vo_ios": {
          "browsers": {
            "ios_saf": {
              "output": [
                {
                  "command": "next_item",
                  "from": "before target",
                  "to": "target",
                  "output": "\"sample text line 1\"",
                  "result": "pass"
                }
              ]
            }
          }
        },
        "orca": {
          "browsers": {
            "firefox": {
              "output": [
                {
                  "command": "next_item",
                  "from": "before target",
                  "to": "target",
                  "output": "\"sample text line 1\"",
                  "result": "pass"
                }
              ]
            }
          }
        }
      }
    }
  ],
  "history": [
    {
      "date": "2018-11-14",
      "message": "Test created"
    },
    {
      "date": "2018-11-14",
      "message": "vo_ios/ios_saf support updated"
    },
    {
      "date": "2019-09-16",
      "message": "add missing results"
    }
  ],
  "versions": {
    "dragon_win": {
      "browsers": {
        "chrome": {
          "at_version": "15.30",
          "browser_version": "76",
          "os_version": "1903",
          "date": "2019-09-16"
        }
      }
    },
    "jaws": {
      "browsers": {
        "chrome": {
          "at_version": "2019.1907.42",
          "browser_version": "76",
          "os_version": "1903",
          "date": "2019-09-16"
        },
        "ie": {
          "at_version": "2019.1907.42",
          "browser_version": "11",
          "os_version": "1903",
          "date": "2019-09-16"
        },
        "firefox": {
          "at_version": "2019.1907.42",
          "browser_version": "69",
          "os_version": "1903",
          "date": "2019-09-16"
        }
      }
    },
    "narrator": {
      "browsers": {
        "edge": {
          "at_version": "1903",
          "browser_version": "44",
          "os_version": "1903",
          "date": "2019-09-16"
        }
      }
    },
    "nvda": {
      "browsers": {
        "chrome": {
          "at_version": "2019.2",
          "browser_version": "76",
          "os_version": "1903",
          "date": "2019-09-16"
        },
        "firefox": {
          "at_version": "2019.2",
          "browser_version": "69",
          "os_version": "1903",
          "date": "2019-09-16"
        }
      }
    },
    "orca": {
      "browsers": {
        "firefox": {
          "at_version": "3.31.4",
          "browser_version": "69",
          "os_version": "Ubuntu 19.04",
          "date": "2019-09-16"
        }
      }
    },
    "talkback": {
      "browsers": {
        "and_chr": {
          "at_version": "7.3.0",
          "browser_version": "76",
          "os_version": "9",
          "date": "2019-09-16"
        }
      }
    },
    "vo_ios": {
      "browsers": {
        "ios_saf": {
          "at_version": "12.4.1",
          "browser_version": "12.4.1",
          "os_version": "12.4.1",
          "date": "2019-09-16"
        }
      }
    },
    "vo_macos": {
      "browsers": {
        "safari": {
          "at_version": "10.14.6",
          "browser_version": "12.1.2",
          "os_version": "10.14.6",
          "date": "2019-09-16"
        }
      }
    }
  }
}
