{
  "title": "aria-describedby attribute on a text input",
  "description": "This test ensures that the accessible description is computed correctly when `aria-describedby` on a text input.",
  "html_file": "aria/aria_describedby.html",
  "assertions": [
    {
      "feature_id": "aria/aria-describedby_attribute",
      "feature_assertion_id": "convey_value_if_valid",
      "results": {
        "jaws": {
          "browsers": {
            "firefox": {
              "output": [
                {
                  "command": "next_focusable_item",
                  "output": "\"Example label, edit, error\"",
                  "result": "pass"
                }
              ]
            },
            "chrome": {
              "output": [
                {
                  "command": "next_focusable_item",
                  "output": "\"Example label, edit, error\"",
                  "result": "pass"
                }
              ]
            },
            "ie": {
              "output": [
                {
                  "command": "next_focusable_item",
                  "output": "\"Example label, edit, error\"",
                  "result": "pass"
                }
              ]
            },
            "edge": {
              "output": [
                {
                  "command": "next_focusable_item",
                  "output": "\"Example label, edit\"",
                  "result": "fail"
                }
              ]
            }
          }
        },
        "narrator": {
          "browsers": {
            "edge": {
              "output": [
                {
                  "command": "next_focusable_item",
                  "output": "\"Example label, editing\"",
                  "result": "fail"
                }
              ]
            }
          }
        },
        "nvda": {
          "browsers": {
            "firefox": {
              "output": [
                {
                  "command": "next_focusable_item",
                  "output": "\"Example label edit has auto complete, error\"",
                  "result": "pass"
                }
              ]
            }
          }
        },
        "orca": {
          "browsers": {
            "firefox": {
              "output": [
                {
                  "command": "next_item",
                  "output": "\"example label, entry\"",
                  "result": "fail"
                },
                {
                  "command": "next_focusable_item",
                  "output": "\"example label, entry, error, focus mode\"",
                  "result": "pass"
                }
              ]
            }
          }
        },
        "vo_ios": {
          "browsers": {
            "ios_saf": {
              "output": [
                {
                  "command": "next_item",
                  "output": "\"Example label, edit text, error\"",
                  "result": "pass"
                }
              ]
            }
          }
        },
        "vo_macos": {
          "browsers": {
            "safari": {
              "output": [
                {
                  "command": "next_item",
                  "output": "\"Example label, edit text, error\"",
                  "result": "pass"
                }
              ]
            }
          }
        },
        "talkback": {
          "browsers": {
            "and_chr": {
              "output": [
                {
                  "command": "next_item",
                  "output": "\"Edit box, example label, error\"",
                  "result": "pass"
                }
              ]
            }
          }
        }
      }
    }
  ],
  "history": [
    {
      "date": "2019-07-27",
      "message": "Talkback results added"
    },
    {
      "date": "2019-02-08",
      "message": "Test created"
    },
    {
      "date": "2019-09-16",
      "message": "Add orca results"
    }
  ],
  "versions": {
    "jaws": {
      "browsers": {
        "chrome": {
          "at_version": "2018.1811.2",
          "browser_version": "72",
          "os_version": "1809",
          "date": "2019-03-08"
        },
        "ie": {
          "at_version": "2018.1811.2",
          "browser_version": "11",
          "os_version": "1809",
          "date": "2019-03-08"
        },
        "firefox": {
          "at_version": "2018.1811.2",
          "browser_version": "60",
          "os_version": "1809",
          "date": "2019-03-08"
        },
        "edge": {
          "at_version": "2018.1811.2",
          "browser_version": "44",
          "os_version": "1809",
          "date": "2019-03-08"
        }
      }
    },
    "narrator": {
      "browsers": {
        "edge": {
          "at_version": "1809",
          "browser_version": "44.17763",
          "os_version": "1809",
          "date": "2019-03-08"
        }
      }
    },
    "nvda": {
      "browsers": {
        "firefox": {
          "at_version": "2018.4.1",
          "browser_version": "65.0.2",
          "os_version": "1804",
          "date": "2019-03-08"
        }
      }
    },
    "orca": {
      "browsers": {
        "firefox": {
          "at_version": "3.31.4",
          "browser_version": "69",
          "os_version": "Ubuntu 19.04",
          "date": "2019-09-16"
        }
      }
    },
    "vo_ios": {
      "browsers": {
        "ios_saf": {
          "at_version": "12.1.4",
          "browser_version": "12.1.4",
          "os_version": "12.1.4",
          "date": "2019-03-08"
        }
      }
    },
    "vo_macos": {
      "browsers": {
        "safari": {
          "at_version": "10.14.3",
          "browser_version": "12.0.3",
          "os_version": "10.14.3",
          "date": "2019-03-08"
        }
      }
    },
    "talkback": {
      "browsers": {
        "and_chr": {
          "at_version": "7.3.0",
          "browser_version": "75",
          "os_version": "7.0",
          "date": "2019-07-27"
        }
      }
    }
  }
}
