{
  "title": "ARIA button name from inner text",
  "description": "This test ensures that the accessible name is computed correctly for inner text.",
  "html_file": "aria/aria_button_examples.html",
  "assertions": [
    {
      "feature_id": "aria/button_role",
      "feature_assertion_id": "convey_accessible_name",
      "css_target": "#target_0",
      "results": {
        "dragon_win": {
          "browsers": {
            "ie": {
              "output": [
                {
                  "command": "activate_actionable_item",
                  "output": "(target was clicked)",
                  "result": "pass"
                },
                {
                  "command": "click_type",
                  "output": "(all elements of type were flagged)",
                  "result": "pass"
                }
              ]
            }
          }
        }
      }
    }
  ],
  "history": [
    {
      "date": "2019-02-08",
      "message": "Test created"
    }
  ],
  "versions": {
    "dragon_win": {
      "browsers": {
        "ie": {
          "at_version": "15.30",
          "browser_version": "11.253",
          "os_version": "1809",
          "date": "2018-11-15"
        }
      }
    }
  }
}